{"schema_version":2,"id":"standard-world","display":{"name":"标准测试世界","description":"开发与性能测试用的发展后世界，不是默认新局：约 50 个节点、25 个聚居地，起始车队 20 列 80 辆，含泰坦和长编组车辆。数值待试玩。"},"configuration":{"width_meters":3300,"height_meters":3100,"minimum_node_spacing_meters":300,"candidate_probability":0.9,"elevation_noise":[{"scale_meters":780,"amplitude":14},{"scale_meters":260,"amplitude":4}],"moisture_noise":[{"scale_meters":600,"amplitude":1}],"river_noise":[{"scale_meters":900,"amplitude":1}],"lake_elevation_threshold":4,"river_band_half_width":0.045,"terrain_bands":[{"terrain":"plains","minimum_elevation":0,"maximum_elevation":18,"minimum_moisture":0.2,"maximum_moisture":0.75,"maximum_relief":1.4,"detour_multiplier":1.12,"maximum_tracks":3},{"terrain":"hills","minimum_elevation":0,"maximum_elevation":18,"minimum_moisture":0,"maximum_moisture":1,"maximum_relief":1.7976931348623157e+308,"detour_multiplier":1.4,"maximum_tracks":3},{"terrain":"forest","minimum_elevation":0,"maximum_elevation":18,"minimum_moisture":0.65,"maximum_moisture":1,"maximum_relief":18,"detour_multiplier":1.25,"maximum_tracks":2},{"terrain":"desert","minimum_elevation":0,"maximum_elevation":18,"minimum_moisture":0,"maximum_moisture":0.2,"maximum_relief":19,"detour_multiplier":1.25,"maximum_tracks":2},{"terrain":"mountains","minimum_elevation":11,"maximum_elevation":18,"minimum_moisture":0,"maximum_moisture":1,"maximum_relief":20,"detour_multiplier":1.65,"maximum_tracks":1}],"terrain_sample_spacing_meters":60,"settlement_ratio":0.5,"lair_ratio":0.3,"hostile_settlement_ratio":0,"lair_weights":[{"type":"small-nest","weight":3},{"type":"large-hive","weight":2}],"resources":[{"good":"ferrous-ore","allowed_terrain_types":["mountains","hills"],"probability":1,"minimum_reserve":1920,"maximum_reserve":3840,"renewable":false,"recovery_units_per_second":0,"regeneration_interval_seconds":600,"global_regeneration_remaining_reserve_ratio":0.25},{"good":"conductive-ore","allowed_terrain_types":["mountains","hills"],"probability":1,"minimum_reserve":1920,"maximum_reserve":3840,"renewable":false,"recovery_units_per_second":0,"regeneration_interval_seconds":600,"global_regeneration_remaining_reserve_ratio":0.25},{"good":"rare-mineral","allowed_terrain_types":["mountains","hills"],"probability":1,"minimum_reserve":1920,"maximum_reserve":3840,"renewable":false,"recovery_units_per_second":0,"regeneration_interval_seconds":600,"global_regeneration_remaining_reserve_ratio":0.25},{"good":"stone","allowed_terrain_types":["mountains","hills"],"probability":1,"minimum_reserve":1920,"maximum_reserve":3840,"renewable":false,"recovery_units_per_second":0,"regeneration_interval_seconds":600,"global_regeneration_remaining_reserve_ratio":0.25},{"good":"silica","allowed_terrain_types":["mountains","hills"],"probability":1,"minimum_reserve":1920,"maximum_reserve":3840,"renewable":false,"recovery_units_per_second":0,"regeneration_interval_seconds":600,"global_regeneration_remaining_reserve_ratio":0.25},{"good":"coal","allowed_terrain_types":["mountains","hills"],"probability":1,"minimum_reserve":1920,"maximum_reserve":3840,"renewable":false,"recovery_units_per_second":0,"regeneration_interval_seconds":600,"global_regeneration_remaining_reserve_ratio":0.25},{"good":"crude-oil","allowed_terrain_types":["desert"],"probability":1,"minimum_reserve":1920,"maximum_reserve":3840,"renewable":false,"recovery_units_per_second":0,"regeneration_interval_seconds":600,"global_regeneration_remaining_reserve_ratio":0.25},{"good":"timber","allowed_terrain_types":["forest"],"probability":1,"minimum_reserve":1920,"maximum_reserve":3840,"renewable":true,"recovery_units_per_second":0.06666666666666667,"regeneration_interval_seconds":600,"global_regeneration_remaining_reserve_ratio":0.25}],"initial_railway":{"maximum_tracks":3,"minimum_initial_tracks":1,"maximum_initial_tracks":2,"additional_cycle_edges":1},"budget":{"maximum_stage_retries":4,"maximum_world_retries":4,"maximum_candidates":50000,"maximum_search_work":400000000},"npc_initialization":{"fill_inputs_and_living_targets":true,"output_reserve_hours":2.0,"minimum_for_sale_vehicles":1,"maximum_for_sale_vehicles":2,"for_sale_vehicle_candidates":["small-locomotive","small-freight-wagon","small-armed-wagon","medium-locomotive","medium-freight-wagon","medium-armed-wagon","large-locomotive","large-freight-wagon","extra-large-locomotive","extra-large-freight-wagon","titan-armed-vehicle"]},"start_constraints":{"minimum_reachable_non_hostile_settlements":2,"minimum_reachable_empty_nodes":1,"require_station":true,"exclude_adjacent_lairs":true,"fully_loaded_purchase_rounds_per_train":1,"required_affordable_commission_design":"small-freight-wagon"},"rules":{"population":"basic-population","market":"basic-market","construction":"basic-construction","railway":"basic-railway","combat":"basic-combat"}},"start":{"initial_money":17422460,"trains":[{"vehicles":["titan-armed-vehicle"],"inventory":[]},{"vehicles":["large-locomotive","large-freight-wagon","large-freight-wagon","large-freight-wagon","large-freight-wagon","large-freight-wagon","large-freight-wagon","large-freight-wagon","large-freight-wagon","large-freight-wagon","large-freight-wagon","large-freight-wagon","large-freight-wagon","large-freight-wagon","large-freight-wagon","large-freight-wagon"],"inventory":[{"voxel":"structural-metal","quantity":16000}]},{"vehicles":["large-locomotive","large-freight-wagon","large-freight-wagon","large-freight-wagon","large-freight-wagon","large-freight-wagon","large-freight-wagon","large-freight-wagon","large-freight-wagon","large-freight-wagon","large-freight-wagon","large-freight-wagon","large-freight-wagon","large-freight-wagon","large-freight-wagon","large-freight-wagon"],"inventory":[{"voxel":"bogie","quantity":88},{"voxel":"control-equipment","quantity":2},{"voxel":"glass","quantity":24},{"voxel":"machine-gun","quantity":46},{"voxel":"storage-equipment","quantity":6},{"voxel":"structural-metal","quantity":6746},{"blueprint":"heavy-turret","quantity":4},{"blueprint":"large-diesel-engine","quantity":2}]},{"vehicles":["medium-locomotive","medium-freight-wagon","medium-freight-wagon"],"inventory":[]},{"vehicles":["medium-locomotive","medium-freight-wagon","medium-freight-wagon"],"inventory":[]},{"vehicles":["medium-locomotive","medium-freight-wagon","medium-freight-wagon"],"inventory":[]},{"vehicles":["medium-locomotive","medium-freight-wagon","medium-freight-wagon"],"inventory":[]},{"vehicles":["medium-locomotive","medium-freight-wagon","medium-freight-wagon"],"inventory":[]},{"vehicles":["medium-locomotive","medium-freight-wagon","medium-freight-wagon"],"inventory":[]},{"vehicles":["medium-locomotive","medium-freight-wagon","medium-freight-wagon"],"inventory":[]},{"vehicles":["medium-locomotive","medium-freight-wagon","medium-freight-wagon"],"inventory":[]},{"vehicles":["medium-locomotive","medium-freight-wagon","medium-freight-wagon"],"inventory":[]},{"vehicles":["medium-locomotive","medium-freight-wagon","medium-freight-wagon"],"inventory":[]},{"vehicles":["small-locomotive","medium-armed-wagon","medium-armed-wagon","medium-armed-wagon"],"inventory":[]},{"vehicles":["small-locomotive","medium-armed-wagon","medium-armed-wagon","medium-armed-wagon"],"inventory":[]},{"vehicles":["small-locomotive","medium-armed-wagon","medium-armed-wagon","medium-armed-wagon"],"inventory":[]},{"vehicles":["small-locomotive","small-freight-wagon"],"inventory":[]},{"vehicles":["small-locomotive"],"inventory":[]},{"vehicles":["small-locomotive"],"inventory":[]},{"vehicles":["small-locomotive"],"inventory":[]}]}}
